{
  "schemaVersion": "1.0",
  "generatedAt": "2026-05-12T22:31:40.594Z",
  "configHash": null,
  "game": {
    "name": "6x4 4096 Ways",
    "version": "1.0.0",
    "mathVersion": "sample-run",
    "layout": "6x4",
    "paySystem": "ways",
    "paylines": 0,
    "targetRTP": 96,
    "maxWin": 5000
  },
  "simulation": {
    "spins": 100000,
    "seed": 12345,
    "engineVersion": "slot-math-engine-template @ a5679c9+",
    "paytableScaleFactor": 0.00006613989367839612,
    "preScaleRTP": 14514.689193000224
  },
  "results": {
    "observedRTP": 0.9741190661046689,
    "rtpPercent": 97.41190661046689,
    "errorMargin": 0.006198064213930023,
    "ci95Lower": 0.9679210018907389,
    "ci95Upper": 0.9803171303185989,
    "rtpBreakdown": {
      "base": 0,
      "free_spins": 0,
      "hold_and_win": 0.01412,
      "cascade": 0.9599990661046705,
      "pick": 0,
      "wheel": 0,
      "respin": 0,
      "gamble": 0
    },
    "hitRate": 0.89768,
    "deadSpinRate": 0.10231999999999997,
    "maxObservedWin": 116.37975691650583
  },
  "volatility": {},
  "features": [
    {
      "id": "hold_and_win",
      "name": "Hold And Win",
      "triggerRate": 0.00124,
      "frequency": "1 in 806",
      "rtpContribution": 0.01412
    },
    {
      "id": "cascade",
      "name": "Cascade",
      "triggerRate": 0.8975299999999999,
      "frequency": "1 in 1",
      "rtpContribution": 0.9599990661046705
    }
  ],
  "notes": [
    "Generic-mechanic sample — no game / vendor IP.",
    "Family: Ways; mechanic: ways.",
    "Sampled by scripts/par-samples-generate.mjs at 100,000 spins, seed 12345.",
    "Two-pass auto-scale: paytable multiplied by 6.6140e-5 to match target_rtp = 96.00% (pre-scale observed RTP = 1451468.92%)."
  ],
  "compliance": {
    "standard": "GLI-16",
    "submitter": "Slot Math Engine Template (P0 #4 sample set)",
    "cycleSize": 100000
  }
}