{
  "schemaVersion": "1.0",
  "generatedAt": "2026-05-12T22:33:29.273Z",
  "configHash": null,
  "game": {
    "name": "Free Spins Expanding Wilds",
    "version": "1.0.0",
    "mathVersion": "sample-run",
    "layout": "5x3",
    "paySystem": "lines",
    "paylines": 5,
    "targetRTP": 96,
    "maxWin": 5000
  },
  "simulation": {
    "spins": 100000,
    "seed": 12345,
    "engineVersion": "slot-math-engine-template @ a5679c9+",
    "paytableScaleFactor": 0.2827434597904122,
    "preScaleRTP": 3.3953039999992014
  },
  "results": {
    "observedRTP": 0.9600000000005816,
    "rtpPercent": 96.00000000005817,
    "errorMargin": 0.006198064213930023,
    "ci95Lower": 0.9538019357866516,
    "ci95Upper": 0.9661980642145116,
    "rtpBreakdown": {
      "base": 0.6745648224725533,
      "free_spins": 0.2854351775276168,
      "hold_and_win": 0,
      "cascade": 0,
      "pick": 0,
      "wheel": 0,
      "respin": 0,
      "gamble": 0
    },
    "hitRate": 0.59634,
    "deadSpinRate": 0.40366,
    "maxObservedWin": 31.97828530229562
  },
  "volatility": {},
  "features": [
    {
      "id": "free_spins",
      "name": "Free Spins",
      "triggerRate": 0.08458,
      "frequency": "1 in 12",
      "rtpContribution": 0.2854351775276168
    }
  ],
  "notes": [
    "Generic-mechanic sample — no game / vendor IP.",
    "Family: Free-Spins; mechanic: free_spins.",
    "Sampled by scripts/par-samples-generate.mjs at 100,000 spins, seed 12345.",
    "Two-pass auto-scale: paytable multiplied by 2.8274e-1 to match target_rtp = 96.00% (pre-scale observed RTP = 339.53%)."
  ],
  "compliance": {
    "standard": "GLI-16",
    "submitter": "Slot Math Engine Template (P0 #4 sample set)",
    "cycleSize": 100000
  }
}